{
  "root_node_id": "incident:pir-2026-04-09-payments-latency",
  "correlation_id": "pir-2026-04-09-payments-latency",
  "causation_id": "pir-analysis-wave-3",
  "occurred_at": "2026-04-09T16:16:00Z",
  "nodes": [
    {
      "node_id": "incident:pir-2026-04-09-payments-latency",
      "node_kind": "incident",
      "title": "Payments latency spike",
      "summary": "P95 payments latency returned below 1.1 seconds after rollback, reroute, and the retry-cap rollout.",
      "status": "STABILIZING",
      "labels": ["incident", "payments-api", "p1", "eu-west-1"],
      "properties": {
        "external_incident_id": "pir-2026-04-09-payments-latency",
        "service": "payments-api",
        "region": "eu-west-1"
      },
      "source_kind": "agent",
      "source_agent": "pir-diagnostic",
      "observed_at": "2026-04-09T16:16:00Z"
    },
    {
      "node_id": "finding:pir-2026-04-09-payments-latency:retry-storm",
      "node_kind": "finding",
      "title": "Retry storm amplified load",
      "summary": "The retry storm was confirmed as the secondary amplifier, and concurrency normalized after the retry-cap rollout.",
      "status": "CONFIRMED",
      "labels": ["finding", "retry", "load"],
      "properties": {
        "external_incident_id": "pir-2026-04-09-payments-latency",
        "source": "latency-dashboard"
      },
      "source_kind": "agent",
      "source_agent": "pir-diagnostic",
      "observed_at": "2026-04-09T16:15:00Z"
    },
    {
      "node_id": "task:pir-2026-04-09-payments-latency:apply-retry-cap",
      "node_kind": "task",
      "title": "Apply retry cap",
      "summary": "Retry cap of 2 with full jitter was rolled out across payments clients.",
      "status": "COMPLETED",
      "labels": ["task", "mitigation", "retry"],
      "properties": {
        "external_incident_id": "pir-2026-04-09-payments-latency",
        "owner": "incident-commander"
      },
      "source_kind": "agent",
      "source_agent": "pir-commander",
      "observed_at": "2026-04-09T16:15:00Z"
    }
  ],
  "relations": [
    {
      "source_node_id": "incident:pir-2026-04-09-payments-latency",
      "target_node_id": "finding:pir-2026-04-09-payments-latency:retry-storm",
      "relation_type": "HAS_FINDING",
      "semantic_class": "causal",
      "rationale": "Concurrency fell back toward baseline after the retry cap rollout, confirming retries amplified the degraded pool.",
      "evidence": "post-mitigation concurrency dashboard plus application logs",
      "confidence": "high",
      "sequence": 5
    },
    {
      "source_node_id": "incident:pir-2026-04-09-payments-latency",
      "target_node_id": "task:pir-2026-04-09-payments-latency:apply-retry-cap",
      "relation_type": "REQUIRES_ACTION",
      "semantic_class": "procedural",
      "rationale": "The mitigation task was executed to stop client amplification while rollback and reroute completed.",
      "method": "Retry cap set to 2 with full jitter in shared client configuration",
      "caused_by_node_id": "finding:pir-2026-04-09-payments-latency:retry-storm",
      "confidence": "high",
      "sequence": 6
    }
  ],
  "node_details": [
    {
      "node_id": "finding:pir-2026-04-09-payments-latency:retry-storm",
      "detail": "The retry storm remained the secondary amplifier of the incident. After the retry-cap rollout, request concurrency fell back toward baseline and queue growth stopped.",
      "revision": 2
    },
    {
      "node_id": "task:pir-2026-04-09-payments-latency:apply-retry-cap",
      "detail": "The retry-cap change was completed with limit 2 and full jitter. Request concurrency and DB wait time fell back toward normal within minutes.",
      "revision": 2
    }
  ]
}
